{
  "schema_version": "retrieval-scenario-v1",
  "scenario_id": "anthropic-dod-dispute-v1",
  "description": "Canonical deposited-PDF scenario for cumulative KoteKomi retrieval-program validation.",
  "fixture": {
    "repository_path": "raw/Anthropic–United_States_Department_of_Defense_dispute.pdf",
    "media_type": "application/pdf",
    "fixture_lock": {
      "state": "locked",
      "sha256": "c63c85796559453acf708dab46a35da36ffed00a408a25275576ba07138e9624",
      "page_count": 8
    }
  },
  "source": {
    "normalized_url": "https://en.wikipedia.org/wiki/Anthropic%E2%80%93United_States_Department_of_Defense_dispute",
    "capture_method": "user_deposited_file"
  },
  "paths": {
    "ingest_expectations": ".agent/scenarios/anthropic-dod-dispute-v1/ingest-expectations.json",
    "suite_directory": ".agent/scenarios/anthropic-dod-dispute-v1/suites"
  },
  "network_policy": "forbidden"
}
